[
{"map_id":"abyss-of-atlans-2","kind":"warp","name":"Warp arrival","x":128,"y":131,"description":"Where the warp menu drops you (50,000 Zen, level 925).","source":"gmo","source_url":"https://globalmuonline.com/guides/abyss-of-atlans-2/","scraped_at":"2026-10-21T20:18:48Z"},
{"map_id":"abyss-of-atlans-2","kind":"hot_spot","name":"Minimap hot spot","x":100,"y":120,"description":"Marked as a hunting spot on the in-game minimap.","source":"gmo","source_url":"https://globalmuonline.com/guides/abyss-of-atlans-2/","scraped_at":"2026-10-21T20:18:48Z"},
{"map_id":"abyss-of-atlans-3","kind":"warp","name":"Warp arrival","x":128,"y":131,"description":"Where the warp menu drops you (50,000 Zen, level 950).","source":"gmo","source_url":"https://globalmuonline.com/guides/abyss-of-atlans-3/","scraped_at":"2026-10-21T20:18:49Z"},
{"map_id":"abyss-of-atlans-3","kind":"event","name":"Elite zone flag 1","x":62,"y":219,"description":"Elite zone marker — the (Elite) monsters of this map patrol around these flags. Kill count and elite spawns are tracked per zone.","source":"gmo","source_url":"https://globalmuonline.com/guides/abyss-of-atlans-3/","scraped_at":"2026-10-21T20:18:49Z"},
{"map_id":"abyss-of-atlans-3","kind":"event","name":"Elite zone flag 2","x":87,"y":235,"description":"Elite zone marker — the (Elite) monsters of this map patrol around these flags. Kill count and elite spawns are tracked per zone.","source":"gmo","source_url":"https://globalmuonline.com/guides/abyss-of-atlans-3/","scraped_at":"2026-10-21T20:18:49Z"},
{"map_id":"abyss-of-atlans-3","kind":"event","name":"Elite zone flag 3","x":89,"y":210,"description":"Elite zone marker — the (Elite) monsters of this map patrol around these flags. Kill count and elite spawns are tracked per zone.","source":"gmo","source_url":"https://globalmuonline.com/guides/abyss-of-atlans-3/","scraped_at":"2026-10-21T20:18:49Z"},
{"map_id":"abyss-of-atlans-3","kind":"event","name":"Elite zone flag 4","x":77,"y":197,"description":"Elite zone marker — the (Elite) monsters of this map patrol around these flags. Kill count and elite spawns are tracked per zone.","source":"gmo","source_url":"https://globalmuonline.com/guides/abyss-of-atlans-3/","scraped_at":"2026-10-21T20:18:49Z"},
{"map_id":"abyss-of-atlans-3","kind":"event","name":"Elite zone flag 5","x":170,"y":195,"description":"Elite zone marker — the (Elite) monsters of this map patrol around these flags. Kill count and elite spawns are tracked per zone.","source":"gmo","source_url":"https://globalmuonline.com/guides/abyss-of-atlans-3/","scraped_at":"2026-10-21T20:18:49Z"},
{"map_id":"abyss-of-atlans-3","kind":"event","name":"Elite zone flag 6","x":154,"y":225,"description":"Elite zone marker — the (Elite) monsters of this map patrol around these flags. Kill count and elite spawns are tracked per zone.","source":"gmo","source_url":"https://globalmuonline.com/guides/abyss-of-atlans-3/","scraped_at":"2026-10-21T20:18:49Z"},
{"map_id":"abyss-of-atlans-3","kind":"event","name":"Elite zone flag 7","x":214,"y":214,"description":"Elite zone marker — the (Elite) monsters of this map patrol around these flags. Kill count and elite spawns are tracked per zone.","source":"gmo","source_url":"https://globalmuonline.com/guides/abyss-of-atlans-3/","scraped_at":"2026-10-21T20:18:49Z"},
{"map_id":"abyss-of-atlans-3","kind":"event","name":"Elite zone flag 8","x":155,"y":28,"description":"Elite zone marker — the (Elite) monsters of this map patrol around these flags. Kill count and elite spawns are tracked per zone.","source":"gmo","source_url":"https://globalmuonline.com/guides/abyss-of-atlans-3/","scraped_at":"2026-10-21T20:18:49Z"},
{"map_id":"abyss-of-atlans-3","kind":"event","name":"Elite zone flag 9","x":135,"y":42,"description":"Elite zone marker — the (Elite) monsters of this map patrol around these flags. Kill count and elite spawns are tracked per zone.","source":"gmo","source_url":"https://globalmuonline.com/guides/abyss-of-atlans-3/","scraped_at":"2026-10-21T20:18:49Z"},
{"map_id":"abyss-of-atlans-3","kind":"event","name":"Elite zone flag 10","x":113,"y":24,"description":"Elite zone marker — the (Elite) monsters of this map patrol around these flags. Kill count and elite spawns are tracked per zone.","source":"gmo","source_url":"https://globalmuonline.com/guides/abyss-of-atlans-3/","scraped_at":"2026-10-21T20:18:49Z"},
{"map_id":"abyss-of-atlans-3","kind":"event","name":"Elite zone flag 11","x":226,"y":120,"description":"Elite zone marker — the (Elite) monsters of this map patrol around these flags. Kill count and elite spawns are tracked per zone.","source":"gmo","source_url":"https://globalmuonline.com/guides/abyss-of-atlans-3/","scraped_at":"2026-10-21T20:18:49Z"},
{"map_id":"abyss-of-atlans-3","kind":"event","name":"Elite zone flag 12","x":207,"y":122,"description":"Elite zone marker — the (Elite) monsters of this map patrol around these flags. Kill count and elite spawns are tracked per zone.","source":"gmo","source_url":"https://globalmuonline.com/guides/abyss-of-atlans-3/","scraped_at":"2026-10-21T20:18:49Z"},
{"map_id":"abyss-of-atlans-3","kind":"event","name":"Elite zone flag 13","x":230,"y":90,"description":"Elite zone marker — the (Elite) monsters of this map patrol around these flags. Kill count and elite spawns are tracked per zone.","source":"gmo","source_url":"https://globalmuonline.com/guides/abyss-of-atlans-3/","scraped_at":"2026-10-21T20:18:49Z"},
{"map_id":"abyss-of-atlans-3","kind":"event","name":"Elite zone flag 14","x":48,"y":86,"description":"Elite zone marker — the (Elite) monsters of this map patrol around these flags. Kill count and elite spawns are tracked per zone.","source":"gmo","source_url":"https://globalmuonline.com/guides/abyss-of-atlans-3/","scraped_at":"2026-10-21T20:18:49Z"},
{"map_id":"abyss-of-atlans-3","kind":"event","name":"Elite zone flag 15","x":29,"y":111,"description":"Elite zone marker — the (Elite) monsters of this map patrol around these flags. Kill count and elite spawns are tracked per zone.","source":"gmo","source_url":"https://globalmuonline.com/guides/abyss-of-atlans-3/","scraped_at":"2026-10-21T20:18:49Z"},
{"map_id":"abyss-of-atlans-3","kind":"event","name":"Elite zone flag 16","x":31,"y":80,"description":"Elite zone marker — the (Elite) monsters of this map patrol around these flags. Kill count and elite spawns are tracked per zone.","source":"gmo","source_url":"https://globalmuonline.com/guides/abyss-of-atlans-3/","scraped_at":"2026-10-21T20:18:49Z"},
{"map_id":"abyss-of-atlans-3","kind":"hot_spot","name":"Minimap hot spot","x":151,"y":185,"description":"Marked as a hunting spot on the in-game minimap.","source":"gmo","source_url":"https://globalmuonline.com/guides/abyss-of-atlans-3/","scraped_at":"2026-10-21T20:18:49Z"},
{"map_id":"abyss-of-atlans","kind":"warp","name":"Warp arrival","x":129,"y":132,"description":"Where the warp menu drops you (50,000 Zen, level 900).","source":"gmo","source_url":"https://globalmuonline.com/guides/abyss-of-atlans/","scraped_at":"2026-10-21T20:18:50Z"},
{"map_id":"abyss-of-atlans","kind":"hot_spot","name":"Minimap hot spot","x":97,"y":148,"description":"Marked as a hunting spot on the in-game minimap.","source":"gmo","source_url":"https://globalmuonline.com/guides/abyss-of-atlans/","scraped_at":"2026-10-21T20:18:50Z"},
{"map_id":"acheron","kind":"gate","name":"Debenter entrance","x":52,"y":162,"description":"Level 300+ required. Gate at 52,161 – 53,163; you arrive at Debenter 19,104.","source":"gmo","source_url":"https://globalmuonline.com/guides/acheron/","scraped_at":"2026-10-21T20:18:51Z"},
{"map_id":"acheron","kind":"gate","name":"Uruk Mountain entrance","x":66,"y":218,"description":"Level 300+ required. Gate at 65,218 – 67,219; you arrive at Uruk Mountain 24,86.","source":"gmo","source_url":"https://globalmuonline.com/guides/acheron/","scraped_at":"2026-10-21T20:18:51Z"},
{"map_id":"acheron","kind":"gate","name":"Nars entrance","x":90,"y":182,"description":"Level 300+ required. Gate at 90,181 – 91,184; you arrive at Nars 213,193.","source":"gmo","source_url":"https://globalmuonline.com/guides/acheron/","scraped_at":"2026-10-21T20:18:51Z"},
{"map_id":"acheron","kind":"gate","name":"Portal 1","x":27,"y":170,"description":"Step on 26,168 – 28,172 and you come out at 112,161.","source":"gmo","source_url":"https://globalmuonline.com/guides/acheron/","scraped_at":"2026-10-21T20:18:51Z"},
{"map_id":"acheron","kind":"gate","name":"Portal 2","x":116,"y":169,"description":"Step on 115,168 – 118,170 and you come out at 33,167.","source":"gmo","source_url":"https://globalmuonline.com/guides/acheron/","scraped_at":"2026-10-21T20:18:51Z"},
{"map_id":"acheron","kind":"gate","name":"Portal 3","x":84,"y":204,"description":"Step on 82,204 – 86,205 and you come out at 151,198.","source":"gmo","source_url":"https://globalmuonline.com/guides/acheron/","scraped_at":"2026-10-21T20:18:51Z"},
{"map_id":"acheron","kind":"gate","name":"Portal 4","x":147,"y":204,"description":"Step on 147,202 – 148,206 and you come out at 81,197.","source":"gmo","source_url":"https://globalmuonline.com/guides/acheron/","scraped_at":"2026-10-21T20:18:51Z"},
{"map_id":"acheron","kind":"warp","name":"Arrival from Debenter","x":54,"y":55,"description":"Where the gate from Debenter (17,106, level 300) puts you.","source":"gmo","source_url":"https://globalmuonline.com/guides/acheron/","scraped_at":"2026-10-21T20:18:51Z"},
{"map_id":"acheron","kind":"warp","name":"Arrival from Uruk Mountain","x":62,"y":64,"description":"Where the gate from Uruk Mountain (19,87, level 300) puts you.","source":"gmo","source_url":"https://globalmuonline.com/guides/acheron/","scraped_at":"2026-10-21T20:18:51Z"},
{"map_id":"acheron","kind":"warp","name":"Arrival from Nars","x":94,"y":95,"description":"Where the gate from Nars (211,190, level 300) puts you.","source":"gmo","source_url":"https://globalmuonline.com/guides/acheron/","scraped_at":"2026-10-21T20:18:51Z"},